[
    {
        "number": 1,
        "name": "Ch'ien / The Creative",
        "chineseName": "乾",
        "judgment": "THE CREATIVE works sublime success, Furthering through perseverance.",
        "image": "The movement of heaven is full of power.\nThus the superior man makes himself strong and\nuntiring.",
        "lines": [
            {
                "lineNumber": 1,
                "type": "yang",
                "meaning": "Hidden dragon. Do not act."
            },
            {
                "lineNumber": 2,
                "type": "yang",
                "meaning": "Dragon appearing in the field.\nIt furthers one to see the great man."
            },
            {
                "lineNumber": 3,
                "type": "yang",
                "meaning": "All day long the superior man is creatively active.\nAt nightfall his mind is still beset with cares.\nDanger. No blame."
            },
            {
                "lineNumber": 4,
                "type": "yang",
                "meaning": "Wavering flight over the depths.\nNo blame."
            },
            {
                "lineNumber": 5,
                "type": "yang",
                "meaning": "Flying dragon in the heavens.\nIt furthers one to see the great man."
            },
            {
                "lineNumber": 6,
                "type": "yang",
                "meaning": "Arrogant dragon will have cause to repent."
            }
        ],
        "upperTrigram": "Ch'ien",
        "lowerTrigram": "Ch'ien",
        "trigramSignificance": {
            "upper": "Heaven",
            "lower": "Heaven",
            "relationship": "Heaven above and heaven below indicate the movement of heaven, creating the idea of time and duration."
        },
        "commentary": [
            "The first hexagram is made up of six unbroken lines. These unbroken lines stand for the primal power, which is light-giving, active, strong, and of the spirit.",
            "The hexagram is consistently strong in character, and since it is without weakness, its essence is power or energy.",
            "Its image is heaven.",
            "Its energy is represented as unrestricted by any fixed conditions in space and is therefore conceived of as motion.",
            "Time is regarded as the basis of this motion.",
            "Thus the hexagram includes also the power of time and the power of persisting in time, that is, duration.",
            "The power represented by the hexagram is to be interpreted in a dual sense in terms of its action on the universe and of its action on the world of men.",
            "In relation to the universe, the hexagram expresses the strong, creative action of the Deity.",
            "In relation to the human world, it denotes the creative action of the holy man or sage, of the ruler or leader of men, who through his power awakens and develops their higher nature."
        ]
    },
    {
        "number": 2,
        "name": "K'un / The Receptive",
        "chineseName": "坤",
        "judgment": "THE RECEPTIVE brings about sublime success,\nFurthering through the perseverance of a mare.\nIf the superior man undertakes something and tries to lead,\nHe goes astray;\nBut if he follows, he finds guidance.\nIt is favorable to find friends in the west and south,\nTo forego friends in the east and north.\nQuiet perseverance brings good fortune.",
        "image": "The earth's condition is receptive devotion.\nThus the superior man who has breadth of character\nCarries the outer world.",
        "lines": [
            {
                "lineNumber": 1,
                "type": "yin",
                "meaning": "When there is hoarfrost underfoot,\nSolid ice is not far off."
            },
            {
                "lineNumber": 2,
                "type": "yin",
                "meaning": "Straight, square, great.\nWithout purpose,\nYet nothing remains unfurthered."
            },
            {
                "lineNumber": 3,
                "type": "yin",
                "meaning": "Hidden lines.\nOne is able to remain persevering.\nIf by chance you are in the service of a king,\nSeek not works, but bring to completion."
            },
            {
                "lineNumber": 4,
                "type": "yin",
                "meaning": "A tied-up sack. No blame, no praise."
            },
            {
                "lineNumber": 5,
                "type": "yin",
                "meaning": "A yellow lower garment brings supreme good fortune."
            },
            {
                "lineNumber": 6,
                "type": "yin",
                "meaning": "Dragons fight in the meadow.\nTheir blood is black and yellow."
            }
        ],
        "upperTrigram": "K'un",
        "lowerTrigram": "K'un",
        "trigramSignificance": {
            "upper": "Earth",
            "lower": "Earth",
            "relationship": "Earth above and earth below, symbolizing the receptive and devotion."
        },
        "commentary": [
            "This hexagram is made up of broken lines only. The broken lines represents the dark, yielding, receptive primal power of yin.",
            "The attribute of the hexagram is devotion; its image is the earth.",
            "It is the perfect complement of THE CREATIVE--the complement, not the opposite, for the Receptive does not combat the Creative but completes it.",
            "It represents nature in contrast to spirit, earth in contrast to heaven, space as against time, the female-maternal as against the male-paternal.",
            "However, as applied to human affairs, the principle of this complementary relationship is found not only in the relation between man and woman, but also in that between prince and minister and between father and son.",
            "Indeed, even in the individual this duality appears in the coexistence of the spiritual world and the world of the senses.",
            "But strictly speaking there is no real dualism here, because there is a clearly defined hierarchic relationship between the two principles."
        ]
    },
    {
        "number": 3,
        "name": "Chun / Difficulty at the Beginning",
        "chineseName": "屯",
        "judgment": "DIFFICULTY AT THE BEGINNING works supreme success,\nFurthering through perseverance.\nNothing should be undertaken.\nIt furthers one to appoint helpers.",
        "image": "Clouds and thunder:\nThe image of DIFFICULTY AT THE BEGINNING.\nThus the superior man\nBrings order out of confusion.",
        "lines": [
            {
                "lineNumber": 1,
                "type": "yang",
                "meaning": "Hesitation and hindrance.\nIt furthers one to remain persevering.\nIt furthers one to appoint helpers."
            },
            {
                "lineNumber": 2,
                "type": "yin",
                "meaning": "Difficulties pile up.\nHorse and wagon part.\nHe is not a robber;\nHe wants to woo when the time comes.\nThe maiden is chaste,\nShe does not pledge herself.\nTen years--then she pledges herself."
            },
            {
                "lineNumber": 3,
                "type": "yin",
                "meaning": "Whoever hunts deer without the forester\nOnly loses his way in the forest.\nThe superior man understands the signs of the time\nAnd prefers to desist.\nTo go on brings humiliation."
            },
            {
                "lineNumber": 4,
                "type": "yin",
                "meaning": "Horse and wagon part.\nStrive for union.\nTo go brings good fortune.\nEverything acts to further."
            },
            {
                "lineNumber": 5,
                "type": "yang",
                "meaning": "Difficulties in blessing.\nA little perseverance brings good fortune.\nGreat perseverance brings misfortune."
            },
            {
                "lineNumber": 6,
                "type": "yin",
                "meaning": "Horse and wagon part.\nBloody tears flow."
            }
        ],
        "upperTrigram": "K'an",
        "lowerTrigram": "Chên",
        "trigramSignificance": {
            "upper": "The Abysmal, Water",
            "lower": "The Arousing, Thunder",
            "relationship": "The Arousing (Thunder) moves upward, while The Abysmal (Water) moves downward, indicating a meeting beset with difficulties."
        },
        "commentary": [
            "The name of the hexagram, Chun, really connotes a blade of grass pushing against an obstacle as it sprouts out of the earth--hence the meaning, \"difficulty at the beginning.\"",
            "The hexagram indicates the way in which heaven and earth bring forth individual beings.",
            "It is their first meeting, which is beset with difficulties.",
            "The lower trigram Chên is the Arousing; its motion is upward and its image is thunder.",
            "The upper trigram K'an stands for the Abysmal, the dangerous.",
            "Its motion is downward and its image is rain.",
            "The situation points to teeming, chaotic profusion; thunder and rain fill the air.",
            "But the chaos clears up.",
            "While the Abysmal sinks, the upward movement eventually passes beyond the danger.",
            "A thunderstorm brings release from tension, and all things breathe freely again."
        ]
    },
    {
        "number": 4,
        "name": "Mêng / Youthful Folly",
        "chineseName": "蒙",
        "judgment": "YOUTHFUL FOLLY has success.\nIt is not I who seek the young fool;\nThe young fool seeks me.\nAt the first oracle I inform him.\nIf he asks two or three times, it is importunity.\nIf he importunes, I give him no information.\nPerseverance furthers.",